{
  "$defs": {
    "PreprocessingRecipe": {
      "additionalProperties": false,
      "properties": {
        "boolean_missing": {
          "const": "train_mode_tie_false_with_indicator",
          "default": "train_mode_tie_false_with_indicator",
          "title": "Boolean Missing",
          "type": "string"
        },
        "categorical": {
          "const": "train_vocabulary_one_hot_with_missing_and_unknown",
          "default": "train_vocabulary_one_hot_with_missing_and_unknown",
          "title": "Categorical",
          "type": "string"
        },
        "entirely_missing": {
          "const": "constant_zero_with_indicator",
          "default": "constant_zero_with_indicator",
          "title": "Entirely Missing",
          "type": "string"
        },
        "fit_scope": {
          "const": "eligible_train_rows_of_one_fold_only",
          "default": "eligible_train_rows_of_one_fold_only",
          "title": "Fit Scope",
          "type": "string"
        },
        "numeric_missing": {
          "const": "train_median_with_indicator",
          "default": "train_median_with_indicator",
          "title": "Numeric Missing",
          "type": "string"
        },
        "output_numbers": {
          "const": "float64_model_inputs_raw_money_remains_exact",
          "default": "float64_model_inputs_raw_money_remains_exact",
          "title": "Output Numbers",
          "type": "string"
        },
        "scaling": {
          "const": "none",
          "default": "none",
          "title": "Scaling",
          "type": "string"
        },
        "version": {
          "const": "forecast-train-only-1.0.0",
          "default": "forecast-train-only-1.0.0",
          "title": "Version",
          "type": "string"
        }
      },
      "title": "PreprocessingRecipe",
      "type": "object"
    }
  },
  "$id": "urn:retailops:forecast:feature_policy:1.0.0",
  "$schema": "https://json-schema.org/draft/2020-12/schema",
  "additionalProperties": false,
  "properties": {
    "closed_target": {
      "const": "retain_in_coverage_exclude_from_scoring",
      "default": "retain_in_coverage_exclude_from_scoring",
      "title": "Closed Target",
      "type": "string"
    },
    "cold_start": {
      "const": "insufficient_data_no_prediction",
      "default": "insufficient_data_no_prediction",
      "title": "Cold Start",
      "type": "string"
    },
    "columns": {
      "default": [
        "origin_lag_1_units",
        "origin_lag_7_units",
        "origin_lag_14_units",
        "origin_lag_28_units",
        "rolling_mean_7",
        "rolling_std_7",
        "rolling_count_7",
        "rolling_mean_14",
        "rolling_std_14",
        "rolling_count_14",
        "rolling_mean_28",
        "rolling_std_28",
        "rolling_count_28",
        "target_weekday",
        "target_week_of_year",
        "target_month",
        "target_quarter",
        "target_is_weekend",
        "target_is_public_holiday",
        "target_is_easter",
        "target_is_christmas",
        "target_is_black_friday",
        "target_is_cyber_monday",
        "target_location_open",
        "target_is_category_season",
        "category_id",
        "brand",
        "country_code",
        "calendar_jurisdiction",
        "channel",
        "planned_regular_price_minor_units",
        "currency",
        "planned_promotion_offered",
        "planned_promotion_type",
        "planned_promotion_discount_basis_points",
        "planned_promotion_minimum_quantity"
      ],
      "items": {
        "type": "string"
      },
      "title": "Columns",
      "type": "array"
    },
    "inventory": {
      "const": "excluded",
      "default": "excluded",
      "title": "Inventory",
      "type": "string"
    },
    "maximum_observation_age_days": {
      "default": 3,
      "maximum": 28,
      "minimum": 1,
      "title": "Maximum Observation Age Days",
      "type": "integer"
    },
    "minimum_active_history_days": {
      "default": 28,
      "maximum": 28,
      "minimum": 1,
      "title": "Minimum Active History Days",
      "type": "integer"
    },
    "minimum_known_history_days": {
      "default": 7,
      "maximum": 28,
      "minimum": 1,
      "title": "Minimum Known History Days",
      "type": "integer"
    },
    "missing_features": {
      "const": "retain_nullable_values_and_fit_train_only",
      "default": "retain_nullable_values_and_fit_train_only",
      "title": "Missing Features",
      "type": "string"
    },
    "preprocessing": {
      "$ref": "#/$defs/PreprocessingRecipe",
      "default": {
        "boolean_missing": "train_mode_tie_false_with_indicator",
        "categorical": "train_vocabulary_one_hot_with_missing_and_unknown",
        "entirely_missing": "constant_zero_with_indicator",
        "fit_scope": "eligible_train_rows_of_one_fold_only",
        "numeric_missing": "train_median_with_indicator",
        "output_numbers": "float64_model_inputs_raw_money_remains_exact",
        "scaling": "none",
        "version": "forecast-train-only-1.0.0"
      }
    },
    "stale_history": {
      "const": "block_run_no_partial_success",
      "default": "block_run_no_partial_success",
      "title": "Stale History",
      "type": "string"
    },
    "truth": {
      "const": "excluded",
      "default": "excluded",
      "title": "Truth",
      "type": "string"
    },
    "version": {
      "const": "forecast-features-1.0.0",
      "default": "forecast-features-1.0.0",
      "title": "Version",
      "type": "string"
    }
  },
  "title": "FeaturePolicy",
  "type": "object"
}
