{
  "closed_target": "retain_in_coverage_exclude_from_scoring",
  "cold_start": "insufficient_data_no_prediction",
  "columns": [
    "origin_lag_1_units",
    "origin_lag_7_units",
    "origin_lag_14_units",
    "origin_lag_28_units",
    "rolling_mean_7",
    "rolling_std_7",
    "rolling_count_7",
    "rolling_mean_14",
    "rolling_std_14",
    "rolling_count_14",
    "rolling_mean_28",
    "rolling_std_28",
    "rolling_count_28",
    "target_weekday",
    "target_week_of_year",
    "target_month",
    "target_quarter",
    "target_is_weekend",
    "target_is_public_holiday",
    "target_is_easter",
    "target_is_christmas",
    "target_is_black_friday",
    "target_is_cyber_monday",
    "target_location_open",
    "target_is_category_season",
    "category_id",
    "brand",
    "country_code",
    "calendar_jurisdiction",
    "channel",
    "planned_regular_price_minor_units",
    "currency",
    "planned_promotion_offered",
    "planned_promotion_type",
    "planned_promotion_discount_basis_points",
    "planned_promotion_minimum_quantity"
  ],
  "inventory": "excluded",
  "maximum_observation_age_days": 3,
  "minimum_active_history_days": 28,
  "minimum_known_history_days": 7,
  "missing_features": "retain_nullable_values_and_fit_train_only",
  "preprocessing": {
    "boolean_missing": "train_mode_tie_false_with_indicator",
    "categorical": "train_vocabulary_one_hot_with_missing_and_unknown",
    "entirely_missing": "constant_zero_with_indicator",
    "fit_scope": "eligible_train_rows_of_one_fold_only",
    "numeric_missing": "train_median_with_indicator",
    "output_numbers": "float64_model_inputs_raw_money_remains_exact",
    "scaling": "none",
    "version": "forecast-train-only-1.0.0"
  },
  "stale_history": "block_run_no_partial_success",
  "truth": "excluded",
  "version": "forecast-features-1.0.0"
}
